{
  "channel_id": "vida-plena-45",
  "job_id": "how-to-cook-potatoes-to-lower-their-glycemic-index-for-bette-vida-plena-45-20260730-122514",
  "hook": "Si la patata te deja con sueño o hambre poco después, quizá no sea solo la cantidad: cocinarla, enfriarla y combinarla bien puede cambiar la respuesta.",
  "sections": [
    {
      "title": "La patata no responde siempre igual",
      "focus": "Por qué la misma patata puede comportarse de forma distinta según la cocción, el enfriado, la ración y el resto del plato."
    },
    {
      "title": "Qué es el almidón resistente",
      "focus": "Explicación sencilla de cómo una parte del almidón puede volverse menos accesible para la digestión tras enfriar la patata cocida."
    },
    {
      "title": "Elegir y preparar las patatas",
      "focus": "Cómo escoger piezas de tamaño parecido, lavarlas, cortarlas con criterio y evitar errores antes de cocerlas."
    },
    {
      "title": "Cocerlas sin complicaciones",
      "focus": "Método práctico de cocción en agua, punto de textura adecuado y señales sencillas para evitar que se deshagan."
    },
    {
      "title": "Enfriar y refrigerar bien",
      "focus": "Cómo bajar la temperatura con seguridad, guardar las patatas tapadas y dejarlas alrededor de 24 horas en la nevera."
    },
    {
      "title": "Comerlas frías o recalentadas",
      "focus": "Opciones para usarlas en ensalada o calentarlas de forma habitual sin convertirlas en un plato pesado."
    },
    {
      "title": "La cantidad sigue importando",
      "focus": "Diferencia práctica entre índice glucémico y carga glucémica, con una orientación visual para ajustar la ración."
    },
    {
      "title": "Añadir proteína al plato",
      "focus": "Cómo huevos, pescado, pollo, legumbres u otras proteínas pueden aportar saciedad y equilibrar una comida con patata."
    },
    {
      "title": "Sumar fibra y grasas saludables",
      "focus": "Verduras, aceite de oliva y otros acompañamientos que ayudan a hacer la digestión más gradual y el plato más completo."
    },
    {
      "title": "Tres comidas cotidianas",
      "focus": "Ejemplos concretos de ensalada templada, plato de cuchara y guarnición sencilla usando patata cocida y enfriada."
    },
    {
      "title": "Errores que reducen el beneficio",
      "focus": "Raciones excesivas, salsas abundantes, falta de verduras y confiar en la técnica como única estrategia."
    },
    {
      "title": "Cuándo pedir orientación",
      "focus": "Precauciones para quienes controlan su glucosa, toman medicación o necesitan ajustes nutricionales individualizados."
    }
  ],
  "narration": "Si la patata te deja con sueño o hambre poco después, quizá no sea solo la cantidad: cocinarla, enfriarla y combinarla bien puede cambiar la respuesta.\n\nEmpieza por una idea práctica. La patata recién cocida y muy caliente no se comporta exactamente igual que esa misma patata después de pasar varias horas en la nevera. Al enfriarse, una parte de su almidón cambia de estructura y puede resultar menos accesible para la digestión. Esto no convierte la patata en un alimento libre de hidratos de carbono, pero sí puede favorecer una respuesta más gradual en algunas personas.\n\nLa primera acción es sencilla: cuece la patata, enfríala por completo y guárdala en la nevera alrededor de 24 horas antes de comerla fría o recalentada.\n\nLa preparación también cuenta.\n\nMucha gente de más de 45 años evita la patata porque la considera siempre un alimento de respuesta rápida. Esa idea es demasiado rígida. No responde igual una ración pequeña de patata cocida acompañada de verduras y pescado que un plato grande de patatas muy calientes, sin fibra y con una salsa abundante.\n\nAquí entran en juego cuatro elementos: la estructura del almidón, la temperatura, la cantidad y los acompañamientos. Piensa en la patata como una misma canción tocada con distintos instrumentos. La melodía sigue ahí, pero la experiencia cambia según cómo se interpreta.\n\nNo hace falta eliminar la patata para comer con criterio.\n\nEl almidón resistente es una parte del almidón que no se descompone con la misma facilidad en el intestino delgado. Después de cocer y enfriar alimentos ricos en almidón, algunas cadenas se reorganizan y quedan más compactas. A este proceso se le suele llamar retrogradación.\n\nDicho de forma sencilla, el almidón cocido se abre con el calor y absorbe agua. Cuando se enfría, una parte vuelve a agruparse. Es parecido a un ovillo que se suelta durante la cocción y después se recoge de nuevo. Cuanto más compacto queda, más difícil resulta que las enzimas digestivas accedan a una parte de él.\n\nEste cambio puede reducir la rapidez con la que una parte de los hidratos se digiere. Sin embargo, la respuesta varía entre personas. También depende de la variedad de patata, la cocción, el tiempo de enfriado, la ración y el conjunto de la comida.\n\nLa técnica ayuda, pero no borra el resto del plato.\n\nPara aplicar el método, empieza con patatas de tamaño parecido. Así se cuecen de forma más uniforme. Lávalas bien bajo el grifo y retira cualquier parte dañada. Puedes cocerlas con piel o peladas. La piel aporta algo de fibra, pero no es imprescindible para que se forme almidón resistente.\n\nSi las vas a usar en ensalada, una buena opción es elegir patatas medianas y cocerlas enteras con piel. Si necesitas ahorrar tiempo, córtalas en trozos grandes del mismo tamaño. Evita hacer cubos muy pequeños desde el principio, porque absorben más agua y pueden deshacerse.\n\nImagina que preparas la comida por la tarde para el día siguiente. Pones cuatro patatas medianas en una olla. Esa cantidad puede servir para dos o tres comidas, según la ración y los acompañamientos. No necesitas cocinar una olla enorme. Preparar una cantidad realista facilita que se conserve bien y evita terminar comiendo más solo para que no sobre.\n\nCocina pensando en la comida de mañana.\n\nColoca las patatas en una olla y cúbrelas con agua fría. Lleva el agua a ebullición y después baja el fuego para mantener una cocción suave. Si hierven con demasiada fuerza, pueden romperse por fuera mientras el centro sigue firme.\n\nEl tiempo depende del tamaño. Unos trozos grandes pueden estar listos antes que una patata entera. En lugar de mirar solo el reloj, pincha la parte más gruesa con un cuchillo fino. Debe entrar con cierta facilidad, pero la patata no tiene que deshacerse.\n\nLa textura ideal es tierna y firme. Piensa en una puerta bien ajustada: se abre sin esfuerzo, pero no se cae del marco. Si las dejas demasiado blandas, seguirán siendo útiles para un puré, pero resultarán menos cómodas para guardar, cortar y recalentar.\n\nCuando estén listas, escúrrelas bien. Déjalas unos minutos para que salga el vapor y la superficie pierda humedad. No las mantengas durante mucho tiempo a temperatura ambiente. En cuanto hayan bajado de temperatura lo suficiente, pásalas a un recipiente limpio y guárdalas en la nevera.\n\nBusca firmeza, no dureza ni puré.\n\nEl enfriado es la parte que más suele pasarse por alto. No basta con dejar la patata diez minutos sobre la encimera. Para favorecer la reorganización de una parte del almidón, conviene enfriarla por completo y mantenerla refrigerada durante varias horas. Una referencia práctica es dejarla alrededor de 24 horas.\n\nGuárdala en un recipiente tapado. Si has cocido varias piezas enteras, puedes refrigerarlas así y cortarlas al día siguiente. Si ya están troceadas, distribúyelas sin amontonarlas demasiado mientras pierden el calor inicial. Después cierra el recipiente.\n\nPor ejemplo, puedes cocerlas después de cenar, guardarlas cuando estén templadas y utilizarlas en la comida del día siguiente. Ese horario encaja sin añadir una tarea complicada. La nevera hace el trabajo mientras tú sigues con tu rutina.\n\nLa seguridad alimentaria sigue siendo prioritaria. Evita dejarlas durante horas a temperatura ambiente y consúmelas dentro de un plazo razonable. Si notas olor extraño, textura viscosa o signos de deterioro, deséchalas.\n\nLa nevera cambia la estructura, no las hace eternas.\n\nAl día siguiente puedes comer la patata fría, templada o recalentada. Una ensalada de patata no tiene por qué llevar salsas pesadas. Puedes cortarla en rodajas y añadir tomate, judías verdes, cebolla suave, huevo cocido y un poco de aceite de oliva.\n\nTambién puedes recalentarla. Parte del almidón resistente formado durante el enfriado puede mantenerse, aunque el resultado depende de la temperatura y del tiempo. No necesitas comer la patata helada para aprovechar el método.\n\nPrueba a saltearla brevemente en una sartén con verduras ya cocinadas. Otra opción es calentarla en el microondas hasta que quede agradable, sin resecarla. El objetivo no es someterla a una segunda cocción larga, sino llevarla a una temperatura apetecible.\n\nPiensa en una chaqueta que conserva parte de su forma aunque la vuelvas a usar. El calentamiento puede modificar la estructura, pero no necesariamente devuelve todo el almidón a su estado inicial.\n\nFría o templada, elige la opción que puedas mantener.\n\nAhora bien, enfriar la patata no significa que la cantidad deje de importar. Aquí conviene distinguir dos conceptos. El índice glucémico describe la rapidez con la que un alimento con hidratos puede elevar la glucosa en una situación concreta. La carga glucémica tiene en cuenta también cuántos hidratos aporta la ración que realmente comes.\n\nUna comparación sencilla: el índice glucémico se parece a la velocidad de un coche. La carga glucémica también mira cuánto dura el trayecto. Una velocidad alta durante unos metros no equivale al mismo recorrido que mantenerla durante muchos kilómetros.\n\nEn la práctica, un plato enorme de patata enfriada puede aportar más hidratos que una ración moderada de patata recién hecha. La técnica de enfriado no compensa automáticamente una cantidad excesiva.\n\nComo orientación visual, prueba con una porción que ocupe aproximadamente un cuarto del plat